{
  "$schema": "https://json-schema.org/draft/2020-12/schema",
  "$id": "https://roughdraft.md/spec/roughdraft-flavored-markdown.schema.json",
  "title": "Roughdraft Flavored Markdown Review Index",
  "description": "A JSON review index for comments and suggestions parsed from Roughdraft Flavored Markdown. The Markdown source remains the normative storage format.",
  "type": "object",
  "additionalProperties": false,
  "required": ["format", "version", "comments", "suggestions"],
  "properties": {
    "format": {
      "const": "roughdraft-flavored-markdown"
    },
    "version": {
      "const": "1.0"
    },
    "source": {
      "type": "object",
      "additionalProperties": false,
      "required": ["markdown"],
      "description": "The document the index was built from. Conformance fixtures carry it so they are self-contained; an API exposing an index for a document the caller already holds may omit it.",
      "properties": {
        "markdown": {
          "type": "string",
          "description": "The complete Markdown source that produced this review index."
        },
        "frontmatter": {
          "type": ["string", "null"],
          "description": "YAML frontmatter content when exposed separately by the parser."
        },
        "endmatter": {
          "type": ["string", "null"],
          "description": "YAML endmatter content when exposed separately by the parser."
        }
      }
    },
    "comments": {
      "type": "array",
      "items": {
        "$ref": "#/$defs/comment"
      }
    },
    "suggestions": {
      "type": "array",
      "items": {
        "$ref": "#/$defs/suggestion"
      }
    }
  },
  "$defs": {
    "id": {
      "type": "string",
      "pattern": "^rd-[cs][0-9]+$"
    },
    "metadata": {
      "type": "object",
      "description": "Record keys from the endmatter that this specification does not define, preserved as parsed.",
      "additionalProperties": true
    },
    "author": {
      "type": "string",
      "minLength": 1
    },
    "timestamp": {
      "type": "string",
      "format": "date-time"
    },
    "anchor": {
      "type": "object",
      "additionalProperties": false,
      "required": ["kind"],
      "description": "The resolved location of a comment's anchor element in the body.",
      "properties": {
        "kind": {
          "enum": ["span", "div", "point"],
          "description": "span anchors inline text, div anchors whole blocks, point anchors a location with no text of its own."
        },
        "text": {
          "type": "string",
          "description": "The text enclosed by the anchor element. Absent for a point anchor."
        },
        "markdown": {
          "type": "string",
          "description": "The content enclosed by the anchor element before Markdown rendering, when available."
        }
      },
      "if": {
        "properties": {
          "kind": {
            "const": "point"
          }
        },
        "required": ["kind"]
      },
      "then": {
        "properties": {
          "text": false
        }
      },
      "else": {
        "required": ["text"]
      }
    },
    "comment": {
      "type": "object",
      "additionalProperties": false,
      "required": ["id", "body", "by", "at"],
      "properties": {
        "id": {
          "$ref": "#/$defs/id"
        },
        "body": {
          "type": "string",
          "description": "Comment text as Markdown, taken from the endmatter record's body."
        },
        "by": {
          "$ref": "#/$defs/author"
        },
        "at": {
          "$ref": "#/$defs/timestamp"
        },
        "re": {
          "$ref": "#/$defs/id",
          "description": "The comment or suggestion this replies to."
        },
        "scope": {
          "enum": ["document"],
          "description": "Present when the comment is about the document as a whole."
        },
        "anchor": {
          "$ref": "#/$defs/anchor"
        },
        "status": {
          "enum": ["resolved"]
        },
        "resolved": {
          "type": "string"
        },
        "metadata": {
          "$ref": "#/$defs/metadata"
        }
      },
      "dependentSchemas": {
        "scope": {
          "description": "A comment about the document as a whole has no anchor.",
          "properties": {
            "anchor": false
          }
        }
      }
    },
    "suggestion": {
      "type": "object",
      "additionalProperties": false,
      "required": ["id", "kind", "by", "at"],
      "properties": {
        "id": {
          "$ref": "#/$defs/id"
        },
        "kind": {
          "enum": ["insert", "delete", "replace"],
          "description": "Read from the anchor element: ins inserts, del deletes, and a span wrapping both replaces."
        },
        "by": {
          "$ref": "#/$defs/author"
        },
        "at": {
          "$ref": "#/$defs/timestamp"
        },
        "text": {
          "type": "string",
          "description": "The inserted or deleted text, for insert and delete suggestions."
        },
        "oldText": {
          "type": "string",
          "description": "The text the document has now, for replace suggestions."
        },
        "newText": {
          "type": "string",
          "description": "The text the edit proposes, for replace suggestions."
        },
        "commentIds": {
          "type": "array",
          "description": "Ids of comments whose re names this suggestion.",
          "items": {
            "$ref": "#/$defs/id"
          },
          "uniqueItems": true
        },
        "status": {
          "enum": ["resolved"]
        },
        "resolved": {
          "type": "string"
        },
        "metadata": {
          "$ref": "#/$defs/metadata"
        }
      },
      "allOf": [
        {
          "if": {
            "properties": {
              "kind": {
                "const": "replace"
              }
            },
            "required": ["kind"]
          },
          "then": {
            "required": ["oldText", "newText"]
          },
          "else": {
            "required": ["text"]
          }
        }
      ]
    }
  }
}
