{
  "format": "roughdraft-flavored-markdown",
  "version": "1.0",
  "source": {
    "markdown": "Ship guest checkout in the beta.\n\n---\nroughdraft: \"1.0\"\ncomments:\n  rd-c1:\n    body: Confirm this excludes SSO-only workspaces.\n    by: user\n    at: \"2026-04-28T12:00:00.000Z\"\n  rd-c2:\n    body: Confirmed, they are out of the beta.\n    by: AI\n    at: \"2026-04-28T12:05:00.000Z\"\n    re: rd-c1\n  rd-c3:\n    body: This reads as a specification rather than a draft.\n    by: user\n    at: \"2026-04-28T12:10:00.000Z\"\n    scope: document\n"
  },
  "comments": [
    {
      "id": "rd-c3",
      "body": "This reads as a specification rather than a draft.",
      "by": "user",
      "at": "2026-04-28T12:10:00.000Z",
      "scope": "document"
    }
  ],
  "suggestions": []
}
