{
  "format": "roughdraft-flavored-markdown",
  "version": "1.0",
  "source": {
    "markdown": "Ship <span id=\"rd-c1\">guest checkout</span> in the beta.\n\n---\nroughdraft: \"1.0\"\ncomments:\n  rd-c1:\n    body: Confirm this excludes SSO-only workspaces.\n    by: user\n    at: \"2026-04-28T12:00:00.000Z\"\n"
  },
  "comments": [
    {
      "id": "rd-c1",
      "body": "Confirm this excludes SSO-only workspaces.",
      "by": "user",
      "at": "2026-04-28T12:00:00.000Z",
      "anchor": {
        "kind": "span",
        "text": "guest checkout"
      }
    }
  ],
  "suggestions": []
}
