{
  "format": "roughdraft-flavored-markdown",
  "version": "1.0",
  "source": {
    "markdown": "The <span id=\"rd-c1\">contract\n\ncrosses</span> a block boundary.\n\n---\nroughdraft: \"1.0\"\ncomments:\n  rd-c1:\n    body: This anchor should not span two paragraphs.\n    by: user\n    at: \"2026-04-28T12:00:00.000Z\"\n"
  },
  "comments": [
    {
      "id": "rd-c1",
      "body": "This anchor should not span two paragraphs.",
      "by": "user",
      "at": "2026-04-28T12:00:00.000Z",
      "anchor": {
        "kind": "span"
      }
    }
  ],
  "suggestions": []
}
