{
  "format": "roughdraft-flavored-markdown",
  "version": "1.0",
  "source": {
    "markdown": "Add <ins id=\"rd-s1\">one concrete example</ins> here.\n\n---\nroughdraft: \"1.0\"\ncomments:\n  rd-c2:\n    body: Use the launch story.\n    by: user\n    at: \"2026-04-28T12:08:00.000Z\"\n    re: rd-s1\nsuggestions:\n  rd-s1:\n    by: AI\n    at: \"2026-04-28T12:05:00.000Z\"\n"
  },
  "comments": [
    {
      "id": "rd-c2",
      "body": "Use the launch story.",
      "by": "user",
      "at": "2026-04-28T12:08:00.000Z",
      "re": "rd-s1"
    }
  ],
  "suggestions": [
    {
      "id": "rd-s1",
      "kind": "insert",
      "text": "one concrete example",
      "by": "AI",
      "at": "2026-04-28T12:05:00.000Z",
      "commentIds": ["rd-c2"]
    }
  ]
}
